{
  "test_id": "HNEI_PANASONIC_18650PF_HPPC_25C",
  "cell_id": "HNEI_PANASONIC_18650PF",
  "test_type": "hppc",
  "temperature_C_min": 25.0,
  "temperature_C_max": 25.0,
  "soc_range_min": 0.04386206896551714,
  "soc_range_max": 1.0,
  "soc_step": 0.1,
  "c_rate_charge": null,
  "c_rate_discharge": null,
  "protocol_description": "5-pulse HPPC at 10% SOC steps (Kollmeyer / HNEI protocol)",
  "num_cycles": 1,
  "soh_pct": 100.0,
  "soh_method": "bol_assumption",
  "cycle_count_at_test": 0,
  "test_year": 2017,
  "n_samples": 102800,
  "duration_s": 97599.39900040627,
  "voltage_observed_min_V": 2.49819,
  "voltage_observed_max_V": 4.17497,
  "current_observed_min_A": -17.40298,
  "current_observed_max_A": 0.0,
  "temperature_observed_min_C": 25.33929,
  "temperature_observed_max_C": 27.93959,
  "sample_dt_min_s": 0.0,
  "sample_dt_median_s": 0.9960014373064041,
  "sample_dt_max_s": 3748.5449966043234,
  "source_doi": "10.17632/wykht8y7tg.1",
  "source_url": "https://data.mendeley.com/datasets/wykht8y7tg/1",
  "source_citation": "Kollmeyer, P. (2018). Panasonic 18650PF Li-ion Battery Data. Mendeley Data, v1. https://doi.org/10.17632/wykht8y7tg.1",
  "source_license": "CC-BY-4.0",
  "source_license_url": "https://creativecommons.org/licenses/by/4.0/"
}