{
  "test_id": "ORNL_LEAF_2013_HPPC_40C",
  "cell_id": "ORNL_LEAF_2013",
  "test_type": "hppc",
  "temperature_C_min": 40.0,
  "temperature_C_max": 40.0,
  "soc_range_min": 0.0,
  "soc_range_max": 1.0,
  "soc_step": 0.1,
  "c_rate_charge": null,
  "c_rate_discharge": null,
  "protocol_description": "Low-current HPPC with 10% SOC steps",
  "num_cycles": 1,
  "soh_pct": 100.0,
  "soh_method": "bol_assumption",
  "cycle_count_at_test": 0,
  "test_year": 2013,
  "n_samples": 13065,
  "duration_s": 47196.100000000006,
  "voltage_observed_min_V": 3.0,
  "voltage_observed_max_V": 4.202,
  "current_observed_min_A": -30.0,
  "current_observed_max_A": 22.5,
  "temperature_observed_min_C": 40.0,
  "temperature_observed_max_C": 40.0,
  "sample_dt_min_s": 0.09999999999854481,
  "sample_dt_median_s": 1.0,
  "sample_dt_max_s": 60.0,
  "source_doi": "10.5281/zenodo.2580327",
  "source_url": "https://zenodo.org/records/2580327",
  "source_citation": "Wiggins, G., Allu, S., & Wang, H. (2019). Battery cell data from a 2013 Nissan Leaf. Oak Ridge National Laboratory. https://doi.org/10.5281/zenodo.2580327",
  "source_license": "MIT",
  "source_license_url": "https://opensource.org/licenses/MIT"
}